{
  "schema": "fmea-mining.effects.v1",
  "version": "1.3.7",
  "status": "local_and_system_effect_hypotheses_only",
  "policy": {
    "noEmpiricalEvents": true,
    "noSeverityWithoutEvidence": true,
    "noAutomaticCausalValidation": true
  },
  "records": [
    {
      "chainId": "FC-HOSE-001",
      "family": "mangueiras_hidraulicas",
      "functionalFailureId": "FF-06",
      "localEffect": {
        "description": "Abrasion da cobertura pode diminuir integridade da mangueira.",
        "status": "possible_unobserved",
        "componentVerified": false
      },
      "systemEffect": {
        "description": "Se evoluir para fuga ou rompimento, pode comprometer fornecimento hidráulico.",
        "status": "possible_unobserved",
        "operationalImpactVerified": false
      },
      "propagationCondition": "O mecanismo deve existir e progredir sob condições reais de serviço; confirmar função, carga, duração e arquitetura OEM antes de atribuir consequência.",
      "diagnosticCaveat": "Abrasão não comprova perda atual de contenção.",
      "sourceIds": [
        "CAT-HYD-HOSE-INSPECT",
        "CAT-HYD-HOSE-FAILURE"
      ],
      "causalityStatus": "engineering_inference_unreviewed",
      "severityRank": null,
      "probability": null,
      "actualEventCount": 0,
      "applicableModelId": null,
      "applicableLocationId": null,
      "oemSerialEffectivity": null,
      "reviewer": null
    },
    {
      "chainId": "FC-HOSE-002",
      "family": "mangueiras_hidraulicas",
      "functionalFailureId": "FF-06",
      "localEffect": {
        "description": "Flexão ou torção inadequada pode produzir trincas/deformação no conjunto flexível.",
        "status": "possible_unobserved",
        "componentVerified": false
      },
      "systemEffect": {
        "description": "Evolução do dano pode levar a vazamento e interrupção de movimentos de implementos.",
        "status": "possible_unobserved",
        "operationalImpactVerified": false
      },
      "propagationCondition": "O mecanismo deve existir e progredir sob condições reais de serviço; confirmar função, carga, duração e arquitetura OEM antes de atribuir consequência.",
      "diagnosticCaveat": "Curva observada não prova raio fora da especificação.",
      "sourceIds": [
        "CAT-HYD-HOSE-INSPECT"
      ],
      "causalityStatus": "engineering_inference_unreviewed",
      "severityRank": null,
      "probability": null,
      "actualEventCount": 0,
      "applicableModelId": null,
      "applicableLocationId": null,
      "oemSerialEffectivity": null,
      "reviewer": null
    },
    {
      "chainId": "FC-HOSE-003",
      "family": "mangueiras_hidraulicas",
      "functionalFailureId": "FF-06",
      "localEffect": {
        "description": "Conexão ou terminal pode deixar de reter óleo pressurizado.",
        "status": "possible_unobserved",
        "componentVerified": false
      },
      "systemEffect": {
        "description": "Perda de fluido pode limitar o circuito hidráulico e gerar parada corretiva.",
        "status": "possible_unobserved",
        "operationalImpactVerified": false
      },
      "propagationCondition": "O mecanismo deve existir e progredir sob condições reais de serviço; confirmar função, carga, duração e arquitetura OEM antes de atribuir consequência.",
      "diagnosticCaveat": "Óleo próximo ao terminal não localiza a origem.",
      "sourceIds": [
        "CAT-HYD-HOSE-INSPECT",
        "CAT-HYD-HOSE-FAILURE"
      ],
      "causalityStatus": "engineering_inference_unreviewed",
      "severityRank": null,
      "probability": null,
      "actualEventCount": 0,
      "applicableModelId": null,
      "applicableLocationId": null,
      "oemSerialEffectivity": null,
      "reviewer": null
    },
    {
      "chainId": "FC-HOSE-004",
      "family": "mangueiras_hidraulicas",
      "functionalFailureId": "FF-06",
      "localEffect": {
        "description": "Exposição térmica pode deteriorar a cobertura e reduzir flexibilidade.",
        "status": "possible_unobserved",
        "componentVerified": false
      },
      "systemEffect": {
        "description": "Degradação progressiva pode produzir perda de estanqueidade hidráulica.",
        "status": "possible_unobserved",
        "operationalImpactVerified": false
      },
      "propagationCondition": "O mecanismo deve existir e progredir sob condições reais de serviço; confirmar função, carga, duração e arquitetura OEM antes de atribuir consequência.",
      "diagnosticCaveat": "Endurecimento aparente não revela temperatura histórica.",
      "sourceIds": [
        "CAT-HYD-HOSE-INSPECT"
      ],
      "causalityStatus": "engineering_inference_unreviewed",
      "severityRank": null,
      "probability": null,
      "actualEventCount": 0,
      "applicableModelId": null,
      "applicableLocationId": null,
      "oemSerialEffectivity": null,
      "reviewer": null
    },
    {
      "chainId": "FC-FD-001",
      "family": "comando_final",
      "functionalFailureId": "FF-02",
      "localEffect": {
        "description": "Abrasivos podem remover material de dentes e superfícies do conjunto redutor.",
        "status": "possible_unobserved",
        "componentVerified": false
      },
      "systemEffect": {
        "description": "Desgaste progressivo pode comprometer a transmissão de torque.",
        "status": "possible_unobserved",
        "operationalImpactVerified": false
      },
      "propagationCondition": "O mecanismo deve existir e progredir sob condições reais de serviço; confirmar função, carga, duração e arquitetura OEM antes de atribuir consequência.",
      "diagnosticCaveat": "Metais no óleo não identificam engrenagem específica.",
      "sourceIds": [
        "SKF-WEAR-SURFACE-FATIGUE",
        "CAT-DRIVE-MAGNET-PLUG",
        "CAT-FLUID-ANALYSIS-101"
      ],
      "causalityStatus": "engineering_inference_unreviewed",
      "severityRank": null,
      "probability": null,
      "actualEventCount": 0,
      "applicableModelId": null,
      "applicableLocationId": null,
      "oemSerialEffectivity": null,
      "reviewer": null
    },
    {
      "chainId": "FC-FD-002",
      "family": "comando_final",
      "functionalFailureId": "FF-02",
      "localEffect": {
        "description": "Água no óleo pode favorecer corrosão e degradação de superfícies lubrificadas.",
        "status": "possible_unobserved",
        "componentVerified": false
      },
      "systemEffect": {
        "description": "Dano interno evolutivo pode comprometer o comando final.",
        "status": "possible_unobserved",
        "operationalImpactVerified": false
      },
      "propagationCondition": "O mecanismo deve existir e progredir sob condições reais de serviço; confirmar função, carga, duração e arquitetura OEM antes de atribuir consequência.",
      "diagnosticCaveat": "Água detectada não comprova corrosão já instalada.",
      "sourceIds": [
        "SKF-ISO15243-BEARING",
        "CAT-FLUID-ANALYSIS-101"
      ],
      "causalityStatus": "engineering_inference_unreviewed",
      "severityRank": null,
      "probability": null,
      "actualEventCount": 0,
      "applicableModelId": null,
      "applicableLocationId": null,
      "oemSerialEffectivity": null,
      "reviewer": null
    },
    {
      "chainId": "FC-FD-003",
      "family": "comando_final",
      "functionalFailureId": "FF-02",
      "localEffect": {
        "description": "Filme lubrificante inadequado pode elevar atrito e dano superficial.",
        "status": "possible_unobserved",
        "componentVerified": false
      },
      "systemEffect": {
        "description": "O redutor pode perder eficiência e confiabilidade conforme o desgaste avança.",
        "status": "possible_unobserved",
        "operationalImpactVerified": false
      },
      "propagationCondition": "O mecanismo deve existir e progredir sob condições reais de serviço; confirmar função, carga, duração e arquitetura OEM antes de atribuir consequência.",
      "diagnosticCaveat": "Troca de baseline químico não demonstra dano físico.",
      "sourceIds": [
        "SKF-ISO15243-BEARING",
        "CAT-DRIVE-MAGNET-PLUG",
        "CAT-FLUID-ANALYSIS-101"
      ],
      "causalityStatus": "engineering_inference_unreviewed",
      "severityRank": null,
      "probability": null,
      "actualEventCount": 0,
      "applicableModelId": null,
      "applicableLocationId": null,
      "oemSerialEffectivity": null,
      "reviewer": null
    },
    {
      "chainId": "FC-FD-004",
      "family": "comando_final",
      "functionalFailureId": "FF-02",
      "localEffect": {
        "description": "Fadiga por contato pode gerar descascamento em pista/elemento rolante.",
        "status": "possible_unobserved",
        "componentVerified": false
      },
      "systemEffect": {
        "description": "A progressão pode aumentar folga, ruído e risco de perda funcional do redutor.",
        "status": "possible_unobserved",
        "operationalImpactVerified": false
      },
      "propagationCondition": "O mecanismo deve existir e progredir sob condições reais de serviço; confirmar função, carga, duração e arquitetura OEM antes de atribuir consequência.",
      "diagnosticCaveat": "Ruído ou limalha não comprovam fadiga do rolamento.",
      "sourceIds": [
        "SKF-ISO15243-BEARING",
        "CAT-DRIVE-MAGNET-PLUG",
        "SKF-WEAR-SURFACE-FATIGUE"
      ],
      "causalityStatus": "engineering_inference_unreviewed",
      "severityRank": null,
      "probability": null,
      "actualEventCount": 0,
      "applicableModelId": null,
      "applicableLocationId": null,
      "oemSerialEffectivity": null,
      "reviewer": null
    },
    {
      "chainId": "FC-COOL-001",
      "family": "arrefecimento",
      "functionalFailureId": "FF-08",
      "localEffect": {
        "description": "Depósitos externos nas aletas podem reduzir passagem de ar.",
        "status": "possible_unobserved",
        "componentVerified": false